{
  "name": "example-resource",
  "arn": "arn:aws:iot:us-east-1:123456789012:thing/example",
  "signalCatalogArn": "arn:aws:iot:us-east-1:123456789012:thing/example",
  "description": "example-value",
  "status": "ACTIVE",
  "creationTime": "2025-03-15T14:30:00Z",
  "lastModificationTime": "2025-03-15T14:30:00Z"
}